{
  "rawInputs": [
    {
      "id": "input-001",
      "type": "free_text",
      "source": "user",
      "content": "新品发布系统把全量刷新改成增量刷新，耗时从 7 小时降到约 5 分钟。",
      "metadata": {}
    }
  ],
  "profile": {
    "name": "示例用户",
    "headline": "后端开发工程师",
    "yearsOfExperience": 3,
    "location": "上海",
    "contacts": {}
  },
  "targets": [
    {
      "id": "target-1",
      "role": "后端开发工程师",
      "jdText": null,
      "keywords": ["Redis", "增量刷新"],
      "priority": 1
    }
  ],
  "experiences": [
    {
      "id": "exp-1",
      "type": "project",
      "name": "新品发布系统",
      "organization": null,
      "period": { "start": "2024.01", "end": "2024.06" },
      "context": {
        "problem": "全量刷新耗时 7 小时以上，发布窗口无法收敛",
        "goal": "把刷新收敛到分钟级",
        "previousState": "定时全量刷新"
      },
      "ownership": "DIRECT",
      "actions": ["将全量刷新改为按变更页面增量刷新", "使用 Redis Pipeline + 并发池批量处理"],
      "decisions": ["用增量刷新替代全量刷新以降低资源峰值"],
      "results": ["刷新耗时由 7h+ 降至约 5min"],
      "technologies": ["Go", "MySQL", "Redis"],
      "claimIds": ["claim-1", "claim-2"],
      "metricIds": ["metric-1"],
      "openQuestions": [],
      "resumeReady": true
    }
  ],
  "claims": [
    {
      "id": "claim-1",
      "experienceId": "exp-1",
      "factIds": ["fact-1", "fact-2"],
      "statement": "将全量刷新改造为按变更页面增量刷新，并用 Redis Pipeline 批量处理",
      "type": "implementation",
      "ownership": "DIRECT",
      "evidenceLevel": "A",
      "confidence": "confirmed",
      "technologies": ["Redis"],
      "metricIds": ["metric-1"],
      "allowedVerbs": ["实现", "优化"],
      "interviewRisk": "LOW",
      "resumeEligible": true,
      "notes": []
    },
    {
      "id": "claim-2",
      "experienceId": "exp-1",
      "factIds": ["fact-1"],
      "statement": "控制批量处理时的内存峰值与并发规模",
      "type": "implementation",
      "ownership": "DIRECT",
      "evidenceLevel": "B",
      "confidence": "confirmed",
      "technologies": ["Redis"],
      "metricIds": [],
      "allowedVerbs": ["实现"],
      "interviewRisk": "MEDIUM",
      "resumeEligible": true,
      "notes": []
    }
  ],
  "metrics": [
    {
      "id": "metric-1",
      "experienceId": "exp-1",
      "label": "刷新耗时",
      "kind": "before_after",
      "before": "7h+",
      "after": "5min",
      "unit": null,
      "direction": "decrease",
      "scope": "新品发布刷新链路",
      "confidence": "confirmed",
      "resumeEligible": true,
      "notes": [],
      "factIds": ["fact-2"]
    }
  ],
  "skills": [
    {
      "name": "后端开发",
      "claimIds": ["claim-1"]
    }
  ],
  "resumeStrategies": [
    {
      "id": "strategy-1",
      "targetId": "target-1",
      "objective": "突出后端性能优化与大规模数据处理能力",
      "requirements": [
        {
          "id": "req-1",
          "category": "skill",
          "statement": "具备大规模缓存刷新与性能优化经验",
          "importance": "MUST",
          "keywords": ["Redis", "性能优化"],
          "evidenceNeeded": "DIRECT 及以上的性能优化 Claim",
          "sourceText": null
        }
      ],
      "requirementCoverage": [
        {
          "requirementId": "req-1",
          "status": "covered",
          "claimIds": ["claim-1"],
          "notes": null
        }
      ],
      "selectedExperienceIds": ["exp-1"],
      "selectedClaimIds": ["claim-1", "claim-2"],
      "excludedClaims": [],
      "sectionPlan": [
        {
          "section": "projects",
          "priority": 1,
          "budget": "2 bullets",
          "experienceIds": ["exp-1"]
        }
      ],
      "emphasis": ["性能优化"],
      "coverageGaps": [],
      "riskNotes": [],
      "claimEvaluations": [
        {
          "claimId": "claim-1",
          "decision": "SELECT",
          "matchedRequirementIds": ["req-1"],
          "strengths": ["直接覆盖核心 requirement"],
          "weaknesses": [],
          "reason": "Ownership 与证据强度足够"
        }
      ]
    }
  ],
  "resumeViews": [
    {
      "id": "view-1",
      "targetId": "target-1",
      "header": {
        "name": "示例用户",
        "targetRole": "后端开发工程师",
        "educationInline": null,
        "contacts": [
          { "label": "邮箱", "value": "user@example.com", "href": "mailto:user@example.com" }
        ]
      },
      "summary": "关注大规模数据处理与性能优化。",
      "skills": [
        { "label": "后端开发", "description": "Go、MySQL、Redis。" }
      ],
      "sections": [
        {
          "type": "project",
          "title": "项目经历",
          "range": null,
          "entries": [
            {
              "time": "2024.01 - 2024.06",
              "title": "新品发布系统",
              "meta": "核心开发",
              "bullets": [
                {
                  "id": "b-1",
                  "text": "面向 17 万页面 Key 的大规模缓存刷新场景，使用 Redis Pipeline + 并发池批量处理并控制内存峰值，将刷新耗时由 7h+ 降至约 5min。",
                  "claimIds": ["claim-1"],
                  "metricIds": ["metric-1"]
                },
                {
                  "id": "b-2",
                  "text": "将全量刷新改造为按变更页面增量刷新，降低资源峰值。",
                  "claimIds": ["claim-1", "claim-2"],
                  "metricIds": []
                }
              ]
            }
          ]
        }
      ],
      "highlightClaimIds": ["claim-1"],
      "notes": [],
      "renderOptions": { "renderer": "kami", "theme": "kami-default", "format": "html" }
    }
  ],
  "facts": [
    {
      "id": "fact-1",
      "statement": "新品发布流程从全量刷新改为按变更页面增量刷新",
      "category": "action",
      "sourceType": "USER",
      "sourceInputIds": ["input-001"],
      "evidenceLocations": [],
      "experienceId": "exp-1",
      "status": "confirmed",
      "confidence": "high",
      "ownership": "DIRECT",
      "resumeValue": "high",
      "notes": null,
      "subject": "USER"
    },
    {
      "id": "fact-2",
      "statement": "刷新耗时由 7h+ 降至约 5min",
      "category": "metric",
      "sourceType": "USER",
      "sourceInputIds": ["input-001"],
      "evidenceLocations": [],
      "experienceId": "exp-1",
      "status": "confirmed",
      "confidence": "high",
      "ownership": "DIRECT",
      "resumeValue": "critical",
      "notes": null,
      "subject": "USER"
    }
  ]
}
